<?xml version="1.0" encoding="UTF-8"?>
<!-- Copyright (c) 2011-2013 Qualcomm Technologies, Inc.  All Rights Reserved. Qualcomm Technologies Proprietary and Confidential. -->
<system xmlns:xsi="http://www.w3.org/2001/XMLSchema-instance" xsi:noNamespaceSchemaLocation="mobileap_cfg.xsd">
	<MobileAPCfg>
		<MobileAPNatCfg>
			<Firewall>/etc/mobileap_firewall.xml</Firewall>
			<NatEntryGenericTimeout>200</NatEntryGenericTimeout>
			<NatEntryICMPTimeout>30</NatEntryICMPTimeout>
			<NatEntryTCPEstablishedTimeout>3600</NatEntryTCPEstablishedTimeout>
			<NatEntryUDPTimeout>60</NatEntryUDPTimeout>
			<DmzIP>0.0.0.0</DmzIP>
			<EnableIPSECVpnPassthrough>1</EnableIPSECVpnPassthrough>
			<EnablePPTPVpnPassthrough>1</EnablePPTPVpnPassthrough>
			<EnableL2TPVpnPassthrough>1</EnableL2TPVpnPassthrough>
			<EnableWebserverWWANAccess>0</EnableWebserverWWANAccess>
			<ALGCfg>
				<EnableRTSPAlg>0</EnableRTSPAlg>
				<EnableSIPAlg>1</EnableSIPAlg>
			</ALGCfg>
		</MobileAPNatCfg>
		<MobileAPLanCfg>
			<Module>qca6174</Module>
			<EnableIPV4>1</EnableIPV4>
			<EnableIPV6>1</EnableIPV6>
			<WlanMode>AP</WlanMode>
			<MobileAPSTABridgeEnable>0</MobileAPSTABridgeEnable>
			<HostAPDCfg>/etc/hostapd.conf</HostAPDCfg>
                        <HostAPDEntropy>/etc/entropy_file</HostAPDEntropy>
			<STAModeHostAPDCfg>/etc/sta_mode_hostapd.conf</STAModeHostAPDCfg>
			<APIPAddr>192.168.225.1</APIPAddr>
			<SubNetMask>255.255.255.0</SubNetMask>
			<EnableDHCPServer>1</EnableDHCPServer>
			<DHCPCfg>
				<StartIP>192.168.225.20</StartIP>
				<EndIP>192.168.225.60</EndIP>
				<LeaseTime>43200</LeaseTime>
			</DHCPCfg>
			<GuestAPCfg>
				<HostAPDCfg>/etc/hostapd-wlan1.conf</HostAPDCfg>
                                <HostAPDEntropy>/etc/entropy_file1</HostAPDEntropy>
				<AccessProfile>INTERNETONLY</AccessProfile>
			</GuestAPCfg>
			<StationModeCfg>
				<SupplicantCfg>/etc/wpa_supplicant.conf</SupplicantCfg>
				<STAModeConnType>1</STAModeConnType>
				<StaticIPAddr>0</StaticIPAddr>
				<StaticConfigDNSAddr>0</StaticConfigDNSAddr>
				<StaticConfigGWAddr>0</StaticConfigGWAddr>
				<StaticConfigNetMask>0</StaticConfigNetMask>
			</StationModeCfg>
		</MobileAPLanCfg>
		<MobileAPWanCfg>
			<AutoConnect>0</AutoConnect>
			<Roaming>0</Roaming>
			<EriConfig>/etc/mobileap_eri_config.bin</EriConfig>
			<TECH>ANY</TECH>
			<V4_UMTS_PROFILE_INDEX>0</V4_UMTS_PROFILE_INDEX>
			<V4_CDMA_PROFILE_INDEX>0</V4_CDMA_PROFILE_INDEX>
			<V6_UMTS_PROFILE_INDEX>0</V6_UMTS_PROFILE_INDEX>
			<V6_CDMA_PROFILE_INDEX>0</V6_CDMA_PROFILE_INDEX>
			<DefaultSIPServerConfigType>FQDN</DefaultSIPServerConfigType>
			<DefaultSIPServerConfig>abcd.com</DefaultSIPServerConfig>
			<PrefixDelegation>0</PrefixDelegation>
		</MobileAPWanCfg>
		<MobileAPSrvcCfg>
				<UPnP>0</UPnP>
				<DLNA>0</DLNA>
				<MDNS>0</MDNS>
		</MobileAPSrvcCfg>
		<MobileAPBootUpCfg>
	    	<MobileAPEnableAtBootup>0</MobileAPEnableAtBootup>
	    	<WLANEnableAtBootup>0</WLANEnableAtBootup>
	    </MobileAPBootUpCfg>
		<Cradle>
			<CradleMode>0</CradleMode>
		</Cradle>
	</MobileAPCfg>
</system>
